{"$schema":"https://json-schema.org/draft/2020-12/schema","$id":"https://github.com/Hawkar-usls/AIFC/schemas/derived-semantic-lineage-audit-v1.schema.json","title":"AIFC Derived Semantic Lineage Audit v1","type":"object","additionalProperties":false,"required":["schema","audit_id","entailment_question_id","derived_semantic_object_id","canonical_semantic_locus_resolution","canonical_semantic_resolver_content_identity","canonical_semantic_resolver_executable_semantics","canonical_semantic_locus_authority_scope","canonical_semantic_resolver_authority","canonical_leaf_manifest_replay","source_multiplicity_preservation","source_context_binding","source_role_binding","derivation_profile_content_identity","derivation_profile_execution_identity","derivation_replay","output_question_binding","output_atom_binding","output_semantic_identity","output_role_binding","dependency_acyclicity","source_authority_resolution","derivation_profile_authority","authority_lineage_replay","derived_semantic_authority","solver_invocation_count","result","blocked_subtype","audit_content_hash"],"properties":{"schema":{"const":"AIFC/derived-semantic-lineage-audit/v1"},"audit_id":{"type":"string","minLength":1},"entailment_question_id":{"type":"string","pattern":"^[0-9a-f]{64}$"},"derived_semantic_object_id":{"type":"string","minLength":1},"canonical_semantic_locus_resolution":{"type":"string","minLength":1},"canonical_semantic_resolver_content_identity":{"type":"string","minLength":1},"canonical_semantic_resolver_executable_semantics":{"type":"string","minLength":1},"canonical_semantic_locus_authority_scope":{"type":"string","minLength":1},"canonical_semantic_resolver_authority":{"type":"string","minLength":1},"canonical_leaf_manifest_replay":{"type":"string","minLength":1},"source_multiplicity_preservation":{"type":"string","minLength":1},"source_context_binding":{"type":"string","minLength":1},"source_role_binding":{"type":"string","minLength":1},"derivation_profile_content_identity":{"type":"string","minLength":1},"derivation_profile_execution_identity":{"type":"string","minLength":1},"derivation_replay":{"type":"string","minLength":1},"output_question_binding":{"type":"string","minLength":1},"output_atom_binding":{"type":"string","minLength":1},"output_semantic_identity":{"type":"string","minLength":1},"output_role_binding":{"type":"string","minLength":1},"dependency_acyclicity":{"type":"string","minLength":1},"source_authority_resolution":{"type":"string","minLength":1},"derivation_profile_authority":{"type":"string","minLength":1},"authority_lineage_replay":{"type":"string","minLength":1},"derived_semantic_authority":{"type":"string","minLength":1},"result":{"type":"string","minLength":1},"blocked_subtype":{"type":"string","minLength":1},"solver_invocation_count":{"type":"integer","minimum":0},"audit_content_hash":{"type":"string","pattern":"^[0-9a-f]{64}$"}}}
