{"schema":"AIFC/derived-semantic-lineage-audit/v1","audit_id":"AIFC-SAL-V1.11-DERIVED-SEMANTIC-LINEAGE-AUDIT-V1","entailment_question_id":"994c979c702b81a0940f28b8039ad36cb48060c426f42eb1f333bf1630e473b6","derived_semantic_object_id":"AIFC-SAL-V1.11-BRIDGE-DERIVED-SEMANTIC-OBJECT-V2","canonical_semantic_locus_resolution":"CONFIRMED_IN_TESTED_SCOPE","canonical_semantic_resolver_content_identity":"CONFIRMED","canonical_semantic_resolver_executable_semantics":"CONFIRMED","canonical_semantic_locus_authority_scope":"CONFIRMED_AS_RESOLVABLE_CANDIDATE_EVIDENCE","canonical_semantic_resolver_authority":"NOT_ESTABLISHED_SUCCESSOR_CANDIDATE","canonical_leaf_manifest_replay":"CONFIRMED","source_multiplicity_preservation":"CONFIRMED","source_context_binding":"CONFIRMED","source_role_binding":"CONFIRMED","derivation_profile_content_identity":"CONFIRMED","derivation_profile_execution_identity":"CONFIRMED","derivation_replay":"CONFIRMED_BY_REPLAY","output_question_binding":"CONFIRMED","output_atom_binding":"CONFIRMED","output_semantic_identity":"CONFIRMED","output_role_binding":"CONFIRMED","dependency_acyclicity":"CONFIRMED_ON_CANONICAL_GRAPH","source_authority_resolution":"NOT_ESTABLISHED_OR_PARTIAL","derivation_profile_authority":"NOT_ESTABLISHED_SUCCESSOR_CANDIDATE","authority_lineage_replay":"NOT_ESTABLISHED","derived_semantic_authority":"BLOCKED","solver_invocation_count":0,"result":"BLOCKED","blocked_subtype":"BLOCKED_UNAUTHORIZED_INTERPRETATION","audit_content_hash":"2e8445b64df9de9b7333f6da5d795615f06763d6ce794685b16e9bf460fc1c58"}
